comment,like
这一期太好笑了哈哈哈哈哈哈哈哈哈笑的我爸骂我精神病哈哈哈哈哈哈哈哈哈哈哈哈哈哈哈哈哈哈哈再看一遍！！小潮team牛逼！！！,4
这期巨！好！看！要不是投币有上限，我高低把一千个币全投进去[热词系列_妙啊],4
高子不是说要为白衣服争气吗？速速起床[doge],4
我许愿让这季离开羊村的全回来[脱单doge]来评论抽我,4
大家都不睡吗~1.6万人[tv_目瞪口呆],4
高斯既没有赢格比赛也没有输掉比赛。这是不拍了就走。估计最后一集的时候会抽到一个球是高回来，然后节目效果爆炸高斯还是没出去。,4
"羊村3它来啦！！整大活太不容易了，
会加快更新，希望观众老爷喜欢本系列！
游戏均为节目效果，请勿当真！感谢大家！
祝大家天天开心！！！
收起",4
就算是剧本马哥也不能走，不在这个账号发流量有影响,4
救命这期节目效果太足了哈哈哈哈哈哈哈哈哈哈哈哈哈哈哈哈哈哈,4
"戒毒宣传片233333
海皇情商很高了，已经很照顾嘉宾了，但奈何小老师不争气233333[笑哭]",4
wc小老师啊啊啊啊啊啊我要疯了救命[大哭],3
小潮现在马上让高斯重回羊村[歪嘴],3
不知道为什么，感觉羊村比现在某些综艺好看很多[热词系列_知识增加],3
看了黑衣服＞白衣服＞其他色衣服[妙啊],3
小潮院长现在读出我的名字读不出来少颗星,3
好期待下一期小潮是什么表现啊[吃瓜],3
这一期真的好好笑，大半夜要笑死了[点赞],3
1.3万人三点多不睡[doge],3
建议除夕夜发第五期给粉丝们整个2个小时超长版[吃瓜][吃瓜],3
笑的我想死 考研休息区,3
有一说一，小精灵这个up我觉得不行，喊小潮我觉得纯就是玩不起，而且也没觉得他这人有多好，别的嘉宾请了观众也想看，当然你请小潮也会有人想看，但是这个行为不是很好，说实在我还是觉得他像是玩不起的类型，那个石头剪刀布那里也不信任，猜输赢也是不相信，开头说看过这个类似视频，但过程中并不像是看过视频的人，视频整体做的不错，但某些人玩不起别硬玩，个人观点经供参考。,3
皇哥啥时候更新[大哭],3
潮总，周杰伦发完新歌了，他什么时候来[doge][给心心],3
忍了一晚上➕一早上，终于在午饭的时候打开了[大笑][大笑],3
高斯现在立刻马上以一颗星回羊村,3
说实话再请潮子回来的话感觉这个游戏性质就变了，请嘉宾应该是想让大家认识更多的人解锁更多的有趣的元素。潮子赢了就是赢了，再请回来觉得一点新意也没有。玩笑这么开确实是挺好玩，真这样的话属实有些无趣。,3
那下一期马哥如果走了是不是可以叫高斯回来[doge],3
两轮都将要走的key是隐藏MVP[妙啊][妙啊],3
想看小精灵和小傲比押韵[兔年],3
下一集小狗走了把高斯寄欧爱吃捞回来[调皮],3
这期确实好笑,3
考研党先存着，之后看,3
小嘉宾一天五颗星浪完了,3
小潮，对嘉宾说一句我爱你,3
刚刚看了半小时羊村3……看完发现是第二季????,3
下期嘉宾：高斯Goh,3
小潮院长下次把高斯叫回来,3
为什么小精灵穿这么薄，不冷吗？[doge],3
一个小时，你们还是要好好休息，别累到自己,3
"我在想啊……
高斯这个“离开羊村”是不是只要出了羊村这个范围就算离开羊村……
也没说一定要回家才算“离开羊村”啊[思考]",3
今天生日，又看到小潮院长更新，双重快乐，祝福小潮院长越来越好[呲牙][呲牙],3
羊村有史以来第一次，嘉宾淘汰的，还有有史以来第一个成功离开羊村，回到家被子还没捂热乎呢又给叫回去的唯有小潮院长一人了[笑哭][笑哭][笑哭],3
投票让一个离开羊村的人强制回来,3
事实上，高斯走没走好像都不影响观感，这个系列高斯确实没啥存在感的说,3
记录一下[微笑],3
一小时的时长和当年只有五分钟的不要做挑战，怀念,3
粉丝留言：小潮，给小傲一颗星并且一整天当海皇员工[兔年],3
粉丝抽奖！让高斯和小潮回来 5星起步成为嘉宾！,3
怎么这杨村三期期巅峰啊！！上一期我寻思是最好看的一期这期更牛逼啊 全程合不拢嘴,3
我盲猜马哥不想来，找其他的up替他来了，感觉是水果哥还是郭雨(预言家),3
嘉宾复活，然后每个人给他二分之一的星[脱单doge][脱单doge][脱单doge],3
小草园子的车牌号码没打好啊[哦呼],3
马哥下期就是嘉宾了，不会把高斯又给请回来了吧[doge],3
马哥辛苦了，居然又一周就发出来了[脱单doge],3
马哥，给大家来一段街舞（拜托了，拜托了，让我进去这个粉丝抽奖盒吧，求你了）,3
看了下时长……啊？？[Muse Dash_大受震撼],3
感觉彩蛋小傲是真的生气了还是节目效果[思考],3
这个让高斯离开羊村的粉丝是谁？高斯前脚说坐近点凑镜头后脚就回去没镜头了[笑哭][笑哭],3
节目效果爆炸,2
来了,2
终于等到你，还好我没放弃[脱单doge],2
这一季质量爆炸啊，各种规则终于完善好了 村规完成度算是极高了，可是好像b站没给引流，这几期播放量远不如第二季刚出的时候[无语],2
29:12 - 29:28 应该不是miku，虽然真的很像,2
抽到这个嘉宾立马离开羊村。,2
这集好好笑哈哈哈,2
我来一个，羊头人现在马上立刻赶快……露脸！！！！！！！！！！！！！！！！！！！！！！！！！！！！！！！！,2
@@@@@bili_46808318879,2
心疼小精灵老师一秒[笑哭][笑哭][笑哭],2
好像有点过分，给马哥又弄回来干啥呀，我是马哥我电报就不知这么点了,2
以后粉丝别弄这种让谁走的了，感觉不舒服,2
8,2
这期也太有意思了吧[喜极而泣],2
这嘉宾老说是剧本有点没意思了，,2
弹幕和评论画风不一样 弹幕全是啊啊啊好可爱 不知道还以为这是啥萌宠节目呢 @⌓‿⌓,2
终于等到你[大哭][大哭][大哭],2
小老师！！！嘿嘿,2
啊啊啊好遗憾高高这期走了啊啊啊啊！！高高的节目效果和小吐槽是特别特别让我喜欢的，也是整体幽默环境里的气口和调和剂，本来前两期镜头很少还期待高高能延续NPC的诅咒多点镜头的呜呜呜呜，不知道后面两期还能不能有返场啊啊啊啊啊[米洛与米姐姐的冒险_倒地不起][米洛与米姐姐的冒险_倒地不起][米洛与米姐姐的冒险_倒地不起],2
？？？？？一个小时？[惊讶][惊讶][惊讶],2
这期小精灵节目效果绝了哈哈哈哈哈哈哈哈哈哈哈哈哈哈哈哈哈哈哈哈哈,2
真的请到小精灵了[小电视_吃惊],2
小精灵老师节目效果比想象中好很多啊。建议以后多亲多近,2
下次嘉宾就是高斯,2
看到这条评论，小潮院长直接获胜,2
这期嘉宾一出来弹幕观感真的是。。。。不适,2
考研加油，大家都上岸,2
地铁惊现小潮team,1
考研加油！！吃中午饭啦,1
元首孙傲,1
第一次这么早呜呜呜呜呜，太开心了又更新了！！！小潮team的大家辛苦了！！！实现和mini糕糕一起看羊村，太开心了www[脱单doge],1
第一眼27分钟？算了小潮也够累的了。第二眼，一个小时！？！？！？小潮万岁！！！,1
"五颗星：小老师。
npc：小子哥。[笑哭]",1
两个灵魂[滑稽][滑稽][滑稽],1
这个时长够我吃好几顿了！,1
JM泪目了呜呜呜竟然可以在羊村看到JJ的名字[大哭],1
"高斯：白衣服中第一个逃离羊村的人
小潮：第一个逃离羊村又被迫返回的人
小精灵：第一个沦为NPC的嘉宾",0
