comment,like
好了，圣诞星是老歌了，我要听新歌[吃瓜][吃瓜],22330
听过了，这首已经是老歌了，新歌什么时候发？,16168
"终于蹲到周董! 冬日暖暖的很贴心~[给心心] 参与#周杰伦新歌来袭#, 赢亲签~👉https://b23.tv/1lOdtrB",7902
"如果， 宇宙中有我这么一颗『星』
我会希望， 是你 发现 我
今年最惊喜的圣诞礼物！
周杰伦Jay Chou
Jay式圣诞小品
圣诞星

有它陪你过圣诞，一个人也可以孤单得很浪漫！
本世纪最浪漫的圣诞小品！ 在全球歌迷千呼万唤、引颈期盼下， 天王周杰伦送给歌迷们这首最惊喜的圣诞礼物「圣诞星」。幸福来得出奇不意， 甚至事先连公司都不知道的这首惊喜「圣诞星」， 周杰伦笑说自己写过很多跟节日有关的歌， 像端午节的「疗伤烧肉粽」、母亲节「听妈妈的话」， 关于圣诞节的歌曲还没写过， 以后大家听圣诞节的歌曲，除了玛丽亚凯莉的， 还有这首歌的选择。而这首歌也是继「等你下课」后，与Gary杨瑞代再度合作， Gary在这首歌中献声， 也一同拍摄MV。

这首「圣诞星」MV，在独具风味的欧洲小镇取景， 以及在充满圣诞节装饰、有壁炉的小木屋里拍摄对嘴画面，周杰伦和杨瑞代与乐手们特别以红色、绿色、格纹、毛衣等穿搭出「圣诞风」造型，更将麦克风架以白色圣诞叶装饰， 加上烛光、灯泡灯饰， 将整个演唱空间营造出浪漫的圣诞氛围！

这首以「圣诞节」为主题的小品「圣诞星」， 描绘在欢乐节庆里「剩单」的心情，原本约好一起共度圣诞的对象，却在这天之前分手了， 只好独自一人布置圣诞树， 心情就像圣诞树上的星， 无人共享； 只能写成一首歌， 献给世界上每个被落单的人。

我的爱就像圣诞树顶的星星
装饰完到最后才能够献上真心
等不及的你没有伫留的脚印
依偎怀里的热情已结冰
我的爱就像圣诞树顶的星星
冰天雪地的夜里只为了你证明
你就像头也不回任性的流星
怎么体会极光的美丽

在充满欢乐、跟最爱的人团聚的圣诞节， 整个世界都准备着礼物、布置圣诞树， 街道变成一片片灯光海， 唯美、欢乐的气氛日日彻夜不眠； 卡片、许愿、圣诞袜、礼物， 这些都只是希望， 重要的人此刻能在身边。如果事与愿违，那就代表， 你长大了。",6413
杰伦的新歌大概就是近些年最好的圣诞礼物了吧[妙啊],5351
"圣诞星(feat.杨瑞代)
驯鹿的响铃和雪花的相遇
当作是我对你离开描绘的旋律柴火写了序暖和童话的过去
远方的烟囱冒着烟该不会是我的卡片(我的卡片)
那是我让圣诞老人捎去的想念(捎去的想念)
壁炉的窗边圣诞袜的许愿等待实现梦境沈睡森林木屋钟声敲醒雪地晨露
熟悉的微笑那是你送我不想拆开的礼物
我放下圣诞的曲目放不下没你的旅途当烛火点燃了孤独我还在回想拥抱的温度
我的爱就像圣诞树顶的星星装饰完到最后才能够献上真心
等不及的你没有伫留的脚印依偎怀里的热情已结冰
我的爱就像圣诞树顶的星星冰天雪地的夜里只为了你证明
你就像头也不回任性的流星怎么体会极光的美丽",4737
"从此之后，圣诞节必听曲目喜提+1
已经预想到每年圣诞大街小巷这首歌的场景了[脱单doge]",4061
这个曲风真的大爱啊啊啊 这说唱 是我爱的jay[给心心][给心心][给心心]是周董送给歌迷的圣诞礼物🎁🎄,4013
"周杰伦是新世纪开头横空出世的紫微星
也是是巨星稀缺偶像泛滥时代永恒的一等星
更是是重塑大众对华语音乐审美标准的启明星
也是指引华语乐坛流行方向的北斗星
冬至快乐，圣诞快乐
周杰伦的《圣诞星》为你降临
请查收圣诞伦送给你的浪漫节日礼物
是免费单曲哦[支持][支持]",2852
你是一个《可爱女人》，我想《等你下课》一起去看《最长的电影》，再去看美丽的《珊瑚海》，到了《晴天》再一起分享我们《不能说的秘密》，等到我们《发如雪》，我们再一起实现我们《蒲公英的约定》，我们《一路向北》，到《红尘客栈》看《青花瓷》，再到《兰亭序》听着《东风破》，最后《安静》的回家,2497
"你的倒影是我带不走的风景～
我的爱就像圣诞树顶的星星～
和弦很像，但多了rap部分，不错的作品[热词系列_妙啊]",2392
像是小时候玩了一整个假期后交出的寒假作业,2220
那个我最爱的男人！！！他来了！这个时间发圣诞星🌟太浪漫了吧[总之就是非常可爱_哇]mv制作好精美好温暖，伦伦又变帅了[总之就是非常可爱_可爱],2206
啊啊啊啊啊我这就是周杰伦送给杰迷的圣诞礼物！而且还不要钱[大哭]周杰伦我爱你啊啊啊啊啊,2088
哇哦，我刷到了什么[嗑瓜子],1875
我不怕被喷。真感觉一般，说实话还是他的快歌还是要有感觉些，快歌才能展现出他的傲气。看来环境真的对人影响太大了，日子好很了（当然并没有说他不该过好日子😂），而且感觉这次选题也很一般，真的很想听到他写飘移，四面楚歌，红模仿的那种快歌，可能再也听不到了🥹。,1798
这声音梦回跨时代！[喜欢][喜欢][喜欢][喜欢][喜欢][喜欢],1569
本世纪最浪漫的圣诞小品！在全球歌迷千呼万唤、引颈期盼下，天王周杰伦送给歌迷们这首最惊喜的圣诞礼物「圣诞星」。幸福来得出奇不意，甚至事先连公司都不知道的这首惊喜「圣诞星」，周杰伦笑说自己写过很多跟节日有关的歌，像端午节的「疗伤烧肉粽」、母亲节「听妈妈的话」，关于圣诞节的歌曲还没写过，以后大家听圣诞节的歌曲，除了玛丽亚凯莉的，还有这首歌的选择。而这首歌也是继「等你下课」后，与Gary杨瑞代再度合作，Gary在这首歌中献声，也一同拍摄MV。,1195
长大以后， 我们不再相信圣诞老公公的存在， 但一定会有一首歌让我们相信，在这个特别的日子里可以不孤单。今年圣诞节，记得寻找城市中每棵圣诞树上的「圣诞星」，这是Jay Chou要传递给你的浪漫守护.,809
很普通，很平庸，很流水线的一首歌，听几秒钟你就会划走，但因为这是周杰伦的作品，所以你才会抽时间听完而已。,753
新歌！！！我来了[打call][打call][打call],658
平平无奇，也不算难听，就像一股微风轻轻从耳边拂过，什么也没留下，但也不伤耳，就这样。,655
跟eason联动[星星眼][星星眼][星星眼],638
属于听完后没有再听第二次的欲望,576
如果有人喷《夜曲》《青花瓷》《七里香》垃圾、不好听，我高低都要和他对线一天；但如果是这首，我只会点赞认同他,567
好前！不过哥下次能不能多发几首，一年等一首太难受了[tv_doge][tv_doge],531
大概率进最伟大作品的曲子，歌词与曲调完全适合上一专辑水平，嘉宾唱的电音也展现出大师水平。配合杰伦粉丝的大量赞叹，让我明白饭的伟大,512
本世纪最浪漫的圣诞小品！在全球歌迷千呼万唤、引颈期盼下，天王周杰伦送给歌迷们这首最惊喜的圣诞礼物「圣诞星」。幸福来得出奇不意，甚至事先连公司都不知道的这首惊喜「圣诞星」，周杰伦笑说自己写过很多跟节日有关的歌，像端午节的「疗伤烧肉粽」、母亲节「听妈妈的话」，关于圣诞节的歌曲还没写过，以后大家听圣诞节的歌曲，除了玛丽亚凯莉的，还有这首歌的选择。而这首歌也是继「等你下课」后，与Gary杨瑞代再度合作，Gary在这首歌中献声，也一同拍摄MV。,506
不说难听，但是确实平淡，和声走向仍然是436 514套路循环……配器没有亮点，和弦也没有任何变化和令人意外的设计[笑哭][笑哭]我个人认为算是“当代工业流水线的标准口水歌”，不难听也经不住推敲回味。,425
杰威尔和杰伦不熟啊🤣,424
作为一个十多年的老粉丝，我的评价是：和预期差不多，他这几年都是这水平[给心心],400
给我的感觉就像是在高档餐厅里用精致的玻璃杯喝一杯白开水，其他不多评价,386
杰伦现在气实在是太短了，受限于嗓子的原因，旋律没法有高低起伏节奏变化，导致后期风格的固化实在是太严重了。最伟大的作品整个专辑包括这首新歌都是一个味，只能说天嫉英才了。,381
看热门评论跟最新评论真挺割裂的,379
这是我今年收到最好的圣诞礼物[打call],369
周杰伦，你这首歌不如改成元梦之星[微笑]这样我就能接受了,301
请叫我大预言家！,270
我是马来西亚人，今天在学校图书馆看书的时候，遇到了几个学长，他们非要让着我教他们口语，可是我也不会啊？F,237
现在每发一首新歌就是对过去积累的声望的一种消耗,237
你觉得你用心了吗，周哥,234
小品？大奋！,228
已经听了几遍了，抱歉没法加入歌单。我甚至没有听圣诞歌曲的感觉,219
没歌其实可以不发的，这首歌把名字换成现在的网红歌手，就是满屏构思,213
JAY CHOU FOR YOU  “我的爱就像圣诞树里的星星，冰天雪地的夜里只为了向你证明” 圣诞快乐【送花花】周杰伦送给歌迷朋友们的礼物🎁 一起来看星星吧✨,180
年轻的周杰伦会怎么看这首歌呢[微笑],167
圣诞节快到了送礼物啦,167
这歌估计也就写完编完也就用了一两天[脸红],163
一点感情没有全程念经，周老师自己听完能知道自己唱的什么东西吗？,163
八度空间随便拉一首都是现在听也超前的旋律，这首的和弦走向真的太平淡了,157
华语乐坛终于赶上周杰伦的水平了，恭喜恭喜！,156
[微笑]再问一次，这个真的是周杰伦吗,153
《伟作》至少还有过去两三分的功力，《圣诞星》我都不敢想象是杰伦写的[滑稽],152
好平的key，属于是我听一遍就不想再听的那种[笑哭]感觉有失水准。。。,131
啊啊啊啊啊啊啊啊啊啊，真的是圣诞星！！！[打call][打call][打call][打call],130
明明2016年还能写出床边故事，怎么就变这样了呢,126
就是有那么多说有歌就不错了的粉丝，周杰伦才会一直写这种水平的歌,120
感谢周董百玩之中写个歌糊弄我们[给心心] 可能青花瓷七里香晴天那样的歌再也不会有了吧 唉,118
首先我不是☁️，我个人觉得一般，说不上不好听，但也说不上好听,111
周杰伦新歌我真的不想说什么了，以前《纽约地铁》都能成为他的废稿，现在《圣诞星》这种都能端上来了，真不知道以前的他看到《圣诞星》会怎么样,107
晚节不保咯，再继续摆下去，就只能继续提纯了，到后面都是结晶，杰出金刚石[大笑],100
对杰伦来说有点太普通了，全盛时期随手拈来的感觉...,97
比难听更致命的是平淡无聊,95
这就是你的公式杰伦啊，你们到底有没有这种的公式啊我想问[汤圆],92
年轻的周董看到以后的自己会写出这样的歌会不会也绷不住[大哭],92
"一首口水歌，鉴定完毕，看了热评全是吹的，唉……还是受了如今华语乐坛的影响，二十年老粉表示，杰伦不该只是这点水平！！！
看看这个时代，我侄子初中同学圈，听的还都是杰伦当年那些歌，好的东西其实大家都能品味出来，其实没多少学生是追现在这些小鲜肉的歌的。",91
"高情商：符合圣诞温馨平和的主题[呲牙]
低情商：寡淡如水，听了和没听一样[大笑]
简单重复的旋律，可有可无的rap，听不出是高潮的高潮部分，不够明显的转音…
很难想象这是曾经rnb天王搞出来的作品，祝你成功吧……",89
史，难道夏洛特烦恼是纪实片？,89
“只是小品”，“写着玩的”，“又没收费”，“别跟正常的比”，“能出就不错了”，“听多了也还行”[doge],84
评论区几位十几年二十年的老歌迷，真的是杰伦有空出一首歌大家一起乐呵乐呵就行吗？这么敷衍的歌，真乐呵的起来吗？搁百十年前听戏的时候，座儿们都要吵着退票了。我们是歌迷，不是无脑吹的那种粉丝。终究还是优秀的音乐作品，才对得起歌迷朋友的支持啊。,76
三分钟，流水线，这是杰伦现在的诚意吗？副歌都和雷同以前这就算了，mv就是一个人晃来晃去说唱也没那味了,75
歌曲越来越拉，而且MV几十年了都一个屁样，欧洲小镇散步➕抬头对口型,72
说实在的，这歌给一些不出名的网络歌手唱也毫无违和感,71
嗓音是回升的，旋律是没有的，音声是稀烂的，调音是发电的，感觉除了mv的服化道和有点好转的嗓音之外一切都那么够使,70
像极了我军训回来的儿子要给我露两手,69
听过了，这首已经是老歌了，新歌什么时候发？[胜利],68
周陶王林就你拉了大胯，咱都能理解，嗓子不行了，你就老老实实开演唱会满足老粉丝的情怀，新歌咱能不出就不出，以免狗尾续貂，给路人听了来一句还没我家哥哥的好听，我怎么怼回去都不知道,66
我能说真的挺一般的吗，只谈歌抛开其他情怀不谈的话,65
杰伦就是在成立杰威尔后开始走下坡路的，自己做主后听不得一点反调，远离了曾经专业的团队提拔了一群溜须拍马的废柴，曾经的杰伦像个叛逆又充满灵性的孩子，虽然有时拽拽的像个不良少年但只要有人敲打就立刻显出稚气可爱的一面，当老板后就内拽在没有了约束和一群跟班奴才的吹捧下就变成了狂妄自大，行为举止也因为知识和阅历的浅薄暴露出来像个暴发户，他的音乐才华无疑在华语乐坛甚至世界乐坛前无来者，就像莫扎特一样没有缘由在少不经事的年纪就能让传世神曲从指尖流出，但其他很多方面他也只是一个普通人，这次幸运星引发的群嘲也是不尊重音乐和歌迷的结果,63
这种质量就是在透支口碑啊，曲子像网红流水线加工出来的。杰伦最多就写了半小时不到，套几个老和弦生拉硬凑点rap杂交rnb；词堪称幽默：“我的爱就像圣诞树顶的星星😂😂。”，只能说把敷衍两个字贴脸上了,58
前奏好听，编曲上有点小东西，然后rap有点感觉，然后就没了。。。听完感觉像喝了一杯稍微有点味道的白开水[笑哭]而且，为什么听着还是伟作那个味，倒影，红颜如霜，粉色海洋[热]就唱的旋律都是这种碎的起伏也不大，蛮失望的，哎,58
这个人是怎么写出来双截棍的？,54
如果不是周杰伦在唱，我都不觉得这会是周杰伦的歌,53
额…已经到了老粉都夸不出来的程度，哥啊，咱能别写这种歌吗[生病],53
听到一半 关了 默默的点开了 八度空间 ......,51
没事 再出新歌这首就封神了,50
至今最烂的一首，因为以后不知道以后还能不能更烂，拉了坨大的属于是，像是三流rapper在网上随便找了个伴奏哼哼两声的感觉，要不是挂着你周杰伦的名字这种烂东西我看都不看一眼[OK],49
"老粉，但这首歌真的有些普通了。
1.旋律太平了，副歌都让人记不住。
2.杰伦唱的有气无力，整体太平了。
3.beat太普通了，没啥设计。
4.风格还在复刻年轻时的自己，缺少了岁月沉淀。（可以对比一下李宗盛退休后的创作，少但精品）",47
换个编曲人，换个制作团队，把杰威尔垃圾公司卖掉换个靠谱点的宣发公司，跟身边那些天天只会尬夸的朋友绝交，跟昆凌分居一段时间，把钱交给叶妈保管，自己带几百块钱买箱泡面住录音棚，身边就留个钢琴，待一年，神专就有了。[doge],47
我原来打算整首歌只用一个loop，是不是很大胆？整首歌啊…,47
我直接祝好评的人天天都只听这首歌,43
难绷 看评论只能看按时间排序了,43
菜，就多写🦀写不出来就别发，以前是以前，现在是现在🦀你要是一直拿以前当现在，哥们，你怎么不拿你刚出道的时候和现在比啊？,43
要不别出新歌了，以前最多被诟病一下唱功，现在连创作都要被诟病了,43
周董的歌，已经没有他之前的创作灵感了，现在的歌说实在话太难听了,42
真是公公又式式，口口又水水啊？,41
这好听吗…一遍下来我都记不住副歌旋律，而且既不冬季也不圣诞,41
最构思的作品[笑哭][响指],40
敢不敢再无聊一点，还是万年不变的几个和弦吉他弹分解，不想认真做音乐真别做了,39
周董，要不咱算了吧，好好养老保重身体，唱歌这种事交给年轻人吧,39
帮杰伦解释一下 因为公司的强烈不作为，新西兰那边时差原因提前发了 然后音源被国内知道了 QQ音乐上都能搜到了 所以才会官方提前发布新歌！再次发生这种重大的时差导致的泄露事故，请大家听官方正式音源，切勿传播盗版！（据悉，本次新歌是周杰伦送给大家的冬日礼物，所以不收费！,39
你点按时间排序是什么居心？😡,39
我是没想到周杰伦也会用这么俗套的和弦走向,38
顶级口水歌，也就只有真爱粉能听下去了要不是披着周杰伦的id，我敢说全网播放量不会超过五位数,38
每发一首历史地位就降一点,37
"别纵容了，说“他老本够吃一辈子了，现在听他有新歌就行”。结果到别人身上，就“写的歌周杰伦十年前就玩儿过了”“比不过周杰伦一根毛”[辣眼睛]
催一下他收益的是听众啊[辣眼睛]你们不想听更牛的歌儿出来吗？？？
还是心里已经默认他写不出夜七夜曲以父之名，所以周郎才尽了[辣眼睛]？？？",37
我只说个人感觉啊 就是如果换一个歌手唱 我听到一半就会关了[笑哭][笑哭][笑哭],37
说真的，但凡一首首听过两千到零八年专辑的老苞米，都不会有自信说想听第二遍,36
感觉我的期待像个笑话[狂小豆_呃呃],35
歌迷在骂，粉丝在护[大笑],34
这歌不断的重复重复重复，一点点起伏都没有，我都怀疑周杰伦只唱了一句就一直复制粘贴了，换成十年前的周杰伦，他写出这种歌，估计都要给自己两巴掌。,34
MV都这样的话真没必要再拍了，走大街捂胸口摇花手重复得太多太多太多太多太多太多，出个音源就够了，虽然音源也不咋的，或者根本就不出，拉低整体水准。敢断言不用一个星期播放量就能和英雄倒影还在流浪之类的碰面了,33
除了杰伦滤镜，作品没彰显任何艺术，灵感和经典的东西，反而给人一种老派过时的感觉，该说不说婚姻带走了他很多东西，他自己是幸福了，年轻的JAY CHOU听了会很失望吧,33
原来最伟大的作品还不是下限[笑哭],32
按时间排序还是有人说实话的,32
不是周杰伦发的歌不会听下去的程度,32
"周杰伦现在就和华语乐坛一起烂完了，这首歌和圣诞的关系是？？？
《last Christmas》《all i want for Christmas is u》《Santa tell me》《圣诞颂歌》（日语）好听的圣诞歌很多，吃点好的
还有qq音乐里面的简介，怎么敢跟玛利亚对标的？！你这首连Taylor，ariana都打不过，烂",32
你点开时间排序的样子真的很狼狈（,32
不难听，但公式化的编曲，mv，歌词，个人感觉都挺敷衍的，这首歌属于外放时什么时候结束或者开始都不会注意到的那种音乐,31
黄雨勋你是在家打煤气灶时候编的曲子吗😅😅😅,31
真是要旋律有苞米，要歌词有苞米,31
但凡这首歌是个网络歌手唱的都属于那种在角落里面都没人听的类型。,31
虽然因为他是周杰伦所以很不想承认，但周董确实没发力，听了两三遍想要找到这首歌出彩的地方，但跟杰伦以往的作品相比还是显得平庸了一些，没有太让人惊艳记忆点，就像是流水线作品,30
这种特效好烦啊，全是精选彩虹屁，就没普通弹幕？,30
像是小时候玩了一整个假期后交出的寒假作业,30
这编曲和歌词突出一个割裂，想写圣诞，又想写失恋。但完全体会不到圣诞的气氛和失恋的伤感，甚至连一点冬天的感觉都没。。。还是好好斟酌一下吧，没有灵感不可怕，出的歌都像一条流水线的才可怕,29
如果周杰伦出道是这首歌，华语乐坛将查无此人,29
整首歌不管是主歌还是副歌部分，平的就像ai唱的一样[呆],28
我怀疑他是夏洛，穿越的歌发完了，现在只能自己写[思考],28
苞米这辈子改不掉赤石的习惯了,28
以后新歌还是这个样子就没什么必要出了,28
这样的歌，04年的周杰伦来了得给现在的一巴掌[辣眼睛],28
既不好听也不难听，很无聊的作品,28
最萎大的作品，这首歌听第一遍就感觉和十几年前网络歌手水平差不多,28
给人一种锐克五抽多了的感觉,27
热门评论让我怀疑是不是我耳朵出某种问题了[尴尬],27
怀疑是夏洛自己写的,27
伴奏是网易云freebeat水平的，歌词是跟圣诞毫无关系的，编排是ctrl c+ctrl v的[疑惑][辣眼睛][捂脸],27
作为一个底层微不足道的粉丝，我还是想说两句，不知道周董还记不记得，2009年常州世界花卉博览会的预热，那时候周董还不是周董，是以超级星秀的身份，作为演员之一登场，但那首菊花台，青花瓷确深深震撼到了台下一个只有八岁的孩子，也在孩子心里埋下了一个学习音乐道路的根。现在十几年过去了，这个孩子已经快要从国内理想的音乐院校毕业，准备赴欧洲继续学习了，但周董这两年创作的作品，确越来越不像那个孩子当年看到的，闪闪发光熠熠生辉，如同神一般的身影了。。。,26
MV猜到是嗯走路➕意义不明的手势了，前后直接复制粘贴➕全程没动过的编曲是想不到的，真是拉了坨大的,26
连装都不装了，前后两个verse一模一样，真就公式化量产网红歌曲是吧，我看前面的热评，我都以为你B给我放错视频了呢，还有内个杨瑞代，那音都修出电音了，实在不行就别唱了[辣眼睛],26
听得出来家庭生活很幸福,26
你敢相信这是写双截棍，双刀，以父之名，夜的第七章的周杰伦写的，真的，要是不想写歌就别写了，没必要这样敷衍了事，这还是你对音乐的态度吗,26
"不管五月天唱得多假 一定会有粉丝洗白
同理 不管周杰伦出的歌有多难听 一定会有粉丝捧臭脚[OK]",26
哥真的别发新歌了，新歌出的越多反差越大，是功成名就了也好现在做音乐是自娱自乐也好，这些我都能理解，但是这么敷衍的作品真没必要发出来，更没必要大力宣传，说难听一点就是浪费听众的耳朵，消费歌迷的期待。我宁愿你真的再也不发新歌一个人在家好好享受音乐，也不要拿出这么无聊的作品来糊弄听众,26
我知道你点开了时间排序,25
周董出道前把这歌给吴宗宪，吴宗宪飞起一脚就把他踹出办公室，就这还想出道？,25
说实话，周杰伦不应该写出这种水平的网络歌曲,25
感觉就是一个强二线城市的模仿秀歌手，找了个当地的奥莱欧洲小镇，给海澜之家男人的衣柜拍了宣传片。,25
说实话如果不是挂了周杰伦这个名号，可能都不会有多少人听，跟网红歌的差不多甚至可能比不过一些网红歌,24
反正周董以前的歌够我循环一辈子的了，新出的歌就听一乐吧,24
"很难听，旋律没有一点圣诞节的快乐气氛，
关于圣诞节的歌曲，曲风却像和尚念经一样",24
如果不是周董的歌，我愿称之为史,24
属于在早餐店放会被嫌土的水平,23
有种TheShy进决赛被人打了个1-16的感觉，这种水平的歌真不如不出,23
歌迷也太容易满足了哈哈哈哈,23
还有一堆人洗地我是真蚌埠住了，跟特么果粉一样，自适应是吧,22
感觉这就是任人唯亲的后果，不管是编曲 造型 还是MV的镜头 作曲都是极其敷衍的感觉,22
这种歌放你年轻的时候，拿来打草稿的资格都没有,22
哎，热评没一个说真话的，这首歌放前十张专辑跟连评选都不够格，能不能做一首高品质音乐啊,22
营销了半天，拉了坨大的[辣眼睛],21
你为什么按时间排序看评论[捂眼],21
按热度和按时间的评论风向截然不同耶[doge],21
全是重复的旋律，歌词。。。不知道为什么要发这首歌,21
如果这是一个网红写的，我会觉得还不错，不难听。但是这是周杰伦写的，这就是屎啊,21
先挂个图，自证不是为黑而黑，结巴唱的还算能对付听，杨瑞代开口绷不住了，这歌真一言难尽,21
如果是为了敷衍粉丝发歌的话，那就没必要再出新歌了[难过],20
咱实在不行不出歌也可以，真没必要这样。,20
额 就我觉得是沟石吗[热词系列_啊?]个人观点,20
这种歌你以前一上午怕不是写20首？,20
为何点按时间排序，心里没点数嘛[doge],20
真的不好听，我爱说实话。,20
难道他真是夏洛？,19
拉屎最好是自己先闻闻,19
