comment,like
我觉得以后可以扮演一下美国国防部长和商务部长[抠鼻][滑稽],0
有棱有角，面相十分英俊，符合我对麦凯撒的想象,0
著名五星上将麦克阿瑟曾讲过，圣诞快乐呀兄弟萌[歪嘴],0
是这位吗？[脱单doge],0
我觉得啊，比付钱更难的是，让外国人学会用筷子吃饭[吃瓜],0
阿巴阿巴,0
第一万位粉丝，不来点奖励[吃瓜],0
23号跑来可没法在圣诞节之前回家[doge],0
麦克阿瑟打仗拉中之拉，演习强中之强,0
"你来了啊
如果说在现实中，你很像，但是这里是b站，只能说还得练",0
不愧是麦跑跑，行军速度很快嘛[doge],0
如果真是历史上的本人不可能会来，不说死了没有，就说领导美军在朝鲜战争杀死我们这么多志愿军弟兄，过来够他死一万次了，无法替他们原谅，但是如果只是扮演者那还好，毕竟没有人命,0
今天12-24，长津湖战役胜利，大家给麦克阿瑟包饺砸儿！硝化甘油馅儿！,0
"各位怎么个个那么喜欢用麦克阿瑟这个人呢？大伙都不查查历史的吗？

1945年8月二战日本投降后，731部队的头目石井四郎与美军司令麦克阿瑟秘密的口头协议，后来又书面化的、保护731部队成员免于被起诉的协议，签署地是1947年日本的镰仓酒馆。（资料来源百度）",0
"什么 麦帅打到中国来了[思考][思考][思考]
老板：来我店里12元猪脚饭钱老实付钱[滑稽][滑稽]
好的 没事了[doge][doge]",0
不是茶叶蛋吃不起，而是猪脚饭更有性价比[doge],0
太酷了,0
麦克阿瑟将军宣布，从2024年开始美军全面普及猪脚饭，取代MRE[doge],0
《志愿军雄兵归来》中的片段，联合国内美国代表说：麦克阿瑟将军的圣诞攻势,0
圣诞节你们吃火鸡开Patty，我们在雪地里啃冰土豆，但是这是你们最后一次圣诞了。,0
我来解释一下，当年麦克阿瑟将军带着机密情报叛逃了，在美国去世的那个是替身，也正是这位麦克阿瑟将军提供的情报让我们打赢了战争[OK],0
麦克阿瑟吃隆江猪脚饭珍贵历史影像泄露,0
满天星上将来店里吃猪脚饭，这个店老板还不马上拍个合照挂门口[doge],0
欢迎五星评论家麦克阿瑟入驻B站,0
"道格拉斯·麦克阿瑟（1880年1月26日—1964年4月5日），男，美国著名军事家，1944年麦克阿瑟被授予陆军五星上将。第二次世界大战时期历任美国远东军司令，西南太平洋战区盟军司令;战后出任驻日盟军最高司令和""联合国军""总司令等职。
啊？",0
天天评价 现在五星天皇真来了[脱单doge],0
起猛了，麦克阿瑟在深圳吃隆江猪脚饭,0
不是仁川登陆复刻不起，而是清川江惨败更有性价比[doge],0
今天平安夜，咱们给联合国军兄弟们包个饺子[福到了][福到了],0
"麦克阿瑟戎马一生，仁川登陆路更是军事史上的杰作。他将人民军拦腰截成两段，战火迅速烧到鸭绿江边，甚至派出大量飞机轰炸中国边境城市。
此前中国就已经数次发起警告，美国总统布鲁门也担心战火持续扩大将会导致中国参战。但麦克阿瑟信心满满地表示中国人不敢参战，如果他们真的敢来，一定让他们有去无回。

麦克阿瑟在说这句话的时候彭老总已经进入了朝鲜战场，可他对此却一无所知。从物质情况上来看志愿军和美军之间确实存在极大差距，美军一个军有430辆坦克，而先期入朝的人民志愿军连一辆坦克都没有。",0
差点以为要挂这面旗子,0
麦克阿瑟嗷，我到BB-61 Iowa战列舰上了，你和你的徒弟呢？,0
好想让麦克阿瑟来萍乡。,0
もう少しでこの旗を掲げるところだった,0
今年圣诞节又回不了家了[doge],0
著名的五星上将麦克.阿瑟将军曾说过:我要用3个月征服朝鲜战争和中国人民志愿军，回美国过圣诞节,0
这才是真麦克阿瑟,0
5693个粉丝，大家手真快,0
日本外籍天皇微服私访品广东猪脚饭[滑稽],0
我是没想到五星天皇居然在中国以这样的方式翻红，虽然读过历史的都很熟悉了,0
啊？？？我第一反应是，麦克阿瑟不是去世了吗。想了两分钟才反应过来是扮演者哈哈哈哈哈,0
平安夜了，麦克阿瑟将军不请士兵们吃顿饺子吗[脱单doge],0
我的军队将在圣诞节前入驻b站！,0
我来解释，真的麦克阿瑟其实死了几十年了，现在我们看到的纪录片里的只是麦克阿瑟一部电影里面的扮演者，本人还在，不是ai。,0
1950年12月24日，正好是咱志愿军在美国阵地上缴获物资，麦克阿瑟回家吃猪脚饭的日子[doge],0
"你好麦克阿瑟将军，今天是平安夜，祝您平安夜快乐。但是，我还想告诉你一件事，你的小伙子们明天回不了家，过不了圣诞节了。
                                     ——志愿军某司令于1950年12月24日，朝鲜",0
你在深圳吃隆江猪脚饭，我在潮汕吃牛肉牛杂双拼饭，我们都有美好的一天[脱单doge],0
报告五星天皇，PLA说要圣诞节给你包饺子，7.62口径的。[doge],0
b站低龄化太严重了 这怎么可能是本人。本人1964年就去世了 太逆天了,0
"1950年6月25日，朝鲜内战爆发 ，南朝鲜首府汉城（首尔）在6月28日被攻陷，6月27日，杜鲁门下令美军支援南朝鲜的作战，7月7日美国操纵联合国安全理事会借联合国名义组建由美国、英国、法国、加拿大、澳大利亚等16个国家参与的“联合国军”参加朝鲜战争，出兵朝鲜干涉朝鲜内战 ，任命麦克阿瑟为“联合国军”总司令。战争期间，麦克阿瑟组织策划仁川登陆将朝鲜人民军拦腰切断，战争形势被完全逆转。毛泽东接受金日成的请求，以志愿军的正当名义出兵朝鲜，任命彭德怀为司令员兼政委。
1950年7月31日，麦克阿瑟从东京到台湾访问，蒋中正两度接见会谈，并分别发表声明，蒋发表谈话谓与麦克阿瑟会谈已奠定中美共同保卫台湾与军事合作之基础；9月15日，策划仁川战役，取得决定性胜利；10月15日，由于麦克阿瑟告知白宫自己太忙不能回华盛顿之后，他在威克岛会见美国总统哈利·S·杜鲁门，杜鲁门只让他打一场有限的战争；10月19日，美军攻占平壤，此时第一批中国人民志愿军分三路秘密进入朝鲜进攻“联合国军”；10月25日至1951年1月8日，经过三次战役，彭德怀率领的中国人民志愿军将麦克阿瑟率领的“联合国军”由鸭绿江边击退回三八线附近。
1951年4月11日，麦克阿瑟主张对中国在东北的军事目标进行打击，必要时动用核武器；杜鲁门恐此举会导致苏联参战而不同意，麦克阿瑟公开反对杜鲁门的决定，派侦察飞机飞入中国领空。志愿军入朝后的前三次战役，“联合国军”遭到失败，第四次战役旗鼓相当；麦克阿瑟缺乏统一朝鲜半岛有效手段，在李奇微出任第八集团军司令并开始扭转战局后，麦克阿瑟越来越令美国军政当局不满。1951年4月11日，杜鲁门以“未能全力支持美国和联合国的政策”为借口撤了他的职，由李奇微（Ridgway）接任。",0
据说影魔奈文摩尔有着一个诗人的灵魂，事实上，他吞噬的诗人灵魂早已成千上万。千百年来，他收集了各式各样的灵魂，包括诗人，牧师，帝王，乞丐，奴隶，哲人，罪犯，当然，还有英雄。他拥有着世间所有种类的灵魂。然而没人知道他收集这些灵魂作何之用。从来没有人得以窥视影魔的魂渊之秘，他从魂渊中伸出灵魂触须，蔓延在精神位面。他是把灵魂一个个吞噬了?还是把灵魂堆积在他的影惧神殿里?又或是将灵魂浸在死灵之池中?难道他仅仅是一个被恶魔傀儡大师操纵着，通过位面裂口进入世界的傀儡?尽管众说纷纭，但根本没有人能看透他那黑暗光环下的层层邪恶。然而，如果实在是很想知道那些灵魂的归宿，有个办法能帮达成心愿：凡人，将灵魂奉献给影魔，或者等待魔王的收割![,0
《警惕某些ai换脸诈骗》[嗑瓜子],0
麦克阿瑟将军，我希望你能去竞争美国大选。[doge],0
阿美莉卡满天星上将 倭国五星天皇 中国互联网五星评论家[脱单doge],0
非常好的视频，志愿军的枪使我旋转，爱来自美利坚,0
看看我的,0
美利坚的凯撒！五星太上皇！麦克阿瑟,0
起猛了，这是圣诞节前夕啊[捂眼],0
天才[OK],0
对此远在KX时间线已经遇刺的美国凯撒麦克阿瑟评价到:老兵不死，只是会回来复仇。（杜鲁门作为一战美国老兵讨薪被麦克阿瑟带骑兵冲击的）,0
if线抗美援朝我们失败了[小电视_发愁]或者if线光头赢了[小电视_哭泣],0
对此，著名评论家五星上将麦克阿瑟评论到,0
隆江猪脚饭就是广东的沙县小吃[蓝屏快乐_看乐子],0
咦，所以他真的生活在中国吗，这个演员,0
