comment,like
哥 你们跨年能不能出个线下团建视频[大哭][大哭],9646
啊啊啊啊啊啊是团建的实况系列，爱看多发[脱单doge][打call],7186
老师，我家番茄怎么叫的这么大声啊，还以为是性格开朗了，仔细一看是疯了[OK],6617
明显看的出来拜应该是玩过的 还有加的miyang整合包 有单独的手电和对讲机模块 但是mod对于新手不太友好 刷怪太多 难度太高了 其实可以只加一个汉化和联机的 感觉像是boy在用的mod给别人安排上了 现在这感觉都没去几个地方 如果要出续集的话 可以多玩玩提高熟练度 不然就换个纯净mod吧 体验会更好（仅代表个人观点 本人致命公司20h玩家 ）,5089
"说明一下，他们玩的这么艰难是因为加的mod太魔幻了，纯净版一般下午1点左右开始刷室内怪，而且只有一两只，不是他们那种开局群魔乱舞，我怀疑是刷怪mod的问题，虽说房主要和玩家一起下同样的mod但有种刷怪mod只能房主一个人添加，不然有多少人下就有多少倍的怪。
最后boy捡了个奇怪的铁板也是mod物品，带前缀“奇怪的”捡了会随机给debuff，但是有bug，boy本来该减速15%，但mod作者写成减速至15%了，所以走的贼慢。",4989
我二十八分钟笑得跟花少北最后那段一样癫哈哈哈哈哈哈,4676
这样，你们录个两小时，我留着当春晚看,4467
"平时的番茄：温文尔雅，风度翩翩
这个视频的番茄：（字正腔圆）握草！握草！握草！！！
非常不错游戏",3776
怎么？[doge]没联系上北子哥？,2808
终于……不是元梦之星了！[大哭],2087
茄哥你怎么了茄哥,1591
老师怎么没看家我家小花,1404
北子哥怎么没联合投稿？[doge],1353
花少北的联投呢[笑哭],1346
为什么四个人的视频感觉有一群人[思考],1344
哇哇哇等到你们的了！,1152
哥几个能不能出个线下视频啊都年底了发个线下团建喜庆一下,1123
没人夸夸剪辑吗！太厉害了，学过一些剧本创作和剪辑，这个视频节奏bgm切镜头剧情逻辑镜头语言过渡闪回（喘气）都极其流畅，可以说半个小时没有一秒是多余的[鼓掌],1052
加了难度mood吧，正常玩很少开门进去就好几个怪刷脸上的，对新人忒不友好[笑哭]（希望哥几个熟了这个游戏多更几期！这个真心节目效果爆炸）,810
这期好好笑，跟着北子那段大笑笑崩了,772
花少北：我被抛弃了 观众朋友们,700
又有人忘记点联合投稿了,460
老师我们小花好像没在里面，我们家孩子回来之后一直在哭，问了才知道是觉得老师不重视他，希望老师能够妥善解决这件事情。,428
王哥假装第一次玩委屈他了，男人帮，启动,366
"wc 新视频不火天理难容！
卧槽，致命公司这个团建视频也太好看了吧，我个人认为啊是所有团建视频里第二好看的一期！！！（第一是火柴人）
 
新视频全程笑疯了，我的妈太有意思了，火速三连，真的求多出几期！太tmd好看了！最近期末，好久都没有笑的这么开心了，好喜欢你们玩这个游戏真的绝了，这个视频不火真的是天理难容！",192
是致命公司！！！自从这个游戏上线就一直期待上海zoo玩了！好喜欢他们玩这种联机恐怖游戏[大哭][大哭][大哭],184
这个视频开始中国boy先说话我想大点声，还没来得及调音花少北就说话了，还好动作慢,177
boy真的好喜欢当小领导[大笑],154
就是说，你们四个能不能一起去密室录个视频，我真的很想看[大哭],153
你们仨拍了多少视频？[星星眼],142
北子醒了哈哈哈哈哈哈哈,141
呜呜，都没人陪哥们玩,134
这加的物品难度低了好多,96
这个游戏是不是会检测玩家音量大小。。？看弹幕说有的怪听觉灵敏,96
老师我们家子涵特别爱看，希望下周还有,94
这期没有字幕嘛,93
出乎我意料的好看！下一季！！！！！！！！！等续集！！！！！！！！别逼我求你！！！！！！！,79
而且怪物的ai是有配合意识的，在未进入攻击状态的囤积虫会捡起战利品并且放在高危险的怪物旁边,66
我说怎么boy头上那个好眼熟（）,64
看了好多UP主录致命公司的实况，还是你们四个最有节目效果[笑哭][笑哭][笑哭],61
开坑开坑，不过怎么感觉今天中国boi的状态不是很好哎？怎么啦？,59
哥几个的视频真的是续命之作……😿,58
四个人吵出了一群人的声音，头回用人声鼎沸形容四个人[doge],57
哥几个圣诞节有说法吗[脱单doge][脱单doge][脱单doge],50
这期质量好高，真的巨好笑，某幻真是长在我笑点上了,48
mod加多了怪也多了有点不太利于新人体验游戏呀，弄个监视器第一视角，对讲机扩音啥的基础mod应该就够用了，因为这个游戏真的超好笑超级出效果，调整一下应该会更精彩的！！,39
北子：联合投稿不联系我是吧,38
北子哥跳楼那一声短笑和后面看boy的狂笑差点给我笑断气,34
刚打完怪猎出来看视频，开头还以为自己游戏没关，搁这找了半天又没找到。直到我把视频暂停了[捂脸],33
"第二天下午了还有1.2万人在看 但是播放量为什么还不上去！！！
给我上去啊[灵魂出窍][灵魂出窍][灵魂出窍][灵魂出窍][灵魂出窍]",33
25分的时候让我想到一句话：植物组之所以能岁月静好，那是因为有动物组负重前行[doge],29
受不了，一看时长接近半小时惊喜万分，结果特么感觉没看一会就没了,28
春晚我要看这个！！！！！！,28
明明只有四个人，却有一种人山人海的既视感……,24
请问对于玩具不点联投这件事三位有什么看法（举话筒）,17
怎么有人没点联合投稿[doge],16
跟我喊 第二期！第二期！第二期！[星星眼],16
虽然冬至过了，但是还是祝大家冬至快乐，团团圆圆啊[打call],16
求求你一定要有下一期！！！,14
团建好唉！！！话说最近这么多团建是在为什么做预热吗…[洛天依][洛天依][洛天依],13
我服了花少北笑王瀚哲跑步那段给我笑岔气了啊啊啊啊啊啊啊,12
我受不了了，我十年没看视频笑成这样了,12
"《致障公司》 
老板:王瀚哲
会计:老番茄
捧场:某幻君
喇叭:花少北 
欢迎大家踊跃报名加入致障公司！",12
开坑开坑！！太有节目效果啦！！！,11
爆炸喜欢这个[喜欢][喜欢][喜欢]快开坑吧，感觉这个游戏里的恐怖元素把每个人的喜剧效果都激发出来了(我也不知道该怎么形容[脸红])反正就特别有意思[保卫萝卜_哇][保卫萝卜_哇],11
花老师的笑声太有感染力了，我想录下来，不开心的时候循环播放,9
这期也太好笑了早知道当春晚看了（）,9
告诉大家一件事情，这个游戏有很多被遗弃的，笔记，都是一些没串通起来的小故事，但是全部收集就可以把故事串通，我们这些人类员工，在公司里面只是收集食物的工具，以及食物本身,9
怎么那么多人说是初音未来 。。（,8
笑点太密集我一时不知道该说什么了哈哈哈哈哈,8
这期真的好看 蛙趣好久没这种觉得自己笑得像个傻子似的视频了[捂脸],8
我是某幻的狗[脱单doge]（别赞要面,8
我真的笑晕了兄弟们,8
早知道这么好笑就留到春晚再看了[doge],7
"友情提示:
在图书馆的朋友们到了食堂再看[微笑]",7
小马好美丽的精神状态，人如其名,7
“注意的东西那就比较的多了啊，一般就是说呢，什么意思，就是，我们之前不是也说过嘛，就是注意的东西，对不对，你想想，对不对啊”,7
"全集最好笑：花少北看王翰哲走路
笑出眼泪了兄弟",7
北子哥点联投了哈哈哈哈哈哈哈哈哈,6
评论区觉得不好笑的，可能是笑点不一样吧hhhhh这期不管是真的巧合还是节目效果，起码我真的得到了情绪价值，看完蛮开心的[妙啊],6
这次的实况，有一种二创的效果（从各方面来说），很好看[支持],6
北子哥是刚起才点的联合投稿吗hhhhhhh,6
我要等明天吃饭的时候看！！,6
怎么不带花少北玩啊[doge],5
好好好，花少北真是为节目效果而生的帅气男人[脱单doge],5
一刀都别剪了，我留着过年看[脱单doge][脱单doge],5
这个游戏真的贼好玩，万人血书开坑,5
这游戏的乐趣究竟是什么,5
听了十遍少北的笑哈哈哈哈哈怎么这么会笑，太搞笑了真的,5
咋没做字幕呀？[捂眼],5
说真的，好久没有看他们四个一起玩然后笑的这么开心了，这期视频可以说是有最早一起玩的那味儿了，多拍一点！！！[星星眼],5
啊哈？北子哥怎么没有联合投稿？[doge],5
这期视频真的好看，可以在你们团建视频里排前几了，每个人都很有节目效果[支持],5
过年当春晚看[脱单doge],5
花少北笑boy走不动那段，真的给人笑崩溃了，口水都笑出来了哈哈哈哈哈哈哈哈,4
省流：进进进！！！啊啊啊！！！焯！！！ 我先走了！！！,4
我怎么感觉，北子哥的声音越来越好听了，尤其是最后笑的那段😂好健康好爽朗，然后还挺好听,4
年末了兄弟几个集体冲业绩是吧[doge],4
下周记得上班哦～[微笑][微笑][微笑]不要忘了嘞！！！[OK][OK][OK],4
太好笑了！！！ 每个人进门甩头后撤出门 我先走了兄弟情（迫真,4
为什么没有花大喇叭！！！[脱单doge],4
北子哥怎么不在联合投稿（）,4
节目效果很好，就是弹幕有点逆天，太结晶了[微笑],4
此时花少北还没投[柠檬派陪你度过漫长岁月_狗头][柠檬派陪你度过漫长岁月_狗头][柠檬派陪你度过漫长岁月_狗头],4
团建 好耶！,4
看了这么多致命公司，你这个笑不出来，又演又尬[尴尬],4
吵得闹心,4
收藏了，过年当春晚看[脱单doge],3
好有意思的视频，节目效果很密集，主要是兄弟们配合的好，哈哈哈哈哈玩的贼有效果,3
这期超级搞笑不看的有难了,3
前排，冬至快乐！！！（怎么不带北子哥玩hhh）,3
友友们，顶我一下，问问中间7：55那个呱呱呱是什么歌,3
我必须马上吃饭[星星眼],3
老师我家北子怎么才刚进,3
男人帮跟NTMD解散了嘛[微笑][doge],3
好玩，就是队友在后面走着走着突然没声了，走了也不说一声，太不够朋友了,3
这游戏四个人的精神状态都很美丽,3
最最最最喜欢看你们四个人玩游戏啊啊啊啊啊啊啊啊啊啊啊啊啊啊啊啊，你们多团建一点好不好,3
我记得这个游戏按业绩指标算，一个队友尸体5块钱，当你发现距目标还差几块时，请小心队友掏出的铲子[滑稽],3
27：34反复观看,3
才十几分钟就这么多评论了,3
笑拥了，这期视频没有一处不体现“兄弟情”的哈哈哈哈哈哈哈哈哈哈哈哈,3
本来打开B站是要找资料准备期末考试的[脸红],3
是谁没有点联合投稿[doge],3
队长已经和巨人融为一体了,3
最后小花那段爆笑哈哈哈哈哈哈哈哈哈哈哈哈哈哈哈哈哈哈哈哈哈哈哈哈哈哈哈哈哈,3
能不能直播玩这个 好好笑,3
大家一定要多多点赞三连啊，求求了，这一期真的爆炸好看爆炸好笑！！！！！各位亲朋好友们一定要记得点赞三连，三连啊求求了[大哭][大哭][大哭][大哭][大哭][大哭]真的好想看到下一期！！！！,3
不行了太好看了两天看了五遍[大哭]请你们务必再多发这个游戏的实况[保卫萝卜_哭哭][保卫萝卜_哭哭][保卫萝卜_哭哭],3
这期真的不错，看下来都没意识到已经过去半个小时了[OK],3
太难了这mod 全是新手 地图怪物道具都不会用 上来刷那么多怪 甚至初级图都有小女孩.这个游戏也是像鹅鸭杀的现象级游戏 换个只有汉化联机+双倍白天时间+充电回血的萌新整合包  可以多拍拍续集[初音未来_大笑]  然后对讲机是用来留个人在终端指挥其他人的[脱单doge],3
陌生人，我今天过生日可以祝我生日快乐吗[嘟嘟][嘟嘟][脱单doge][脱单doge],3
还想看,3
我也是和朋友一起玩的哈哈,3
不行这一期太好笑了 再看一遍,3
这样吧，开成一个系列吧[脱单doge],3
植物组俩个人凑不齐一个胆,3
更新第二集吧哥，真的好看，求你们了[无语],3
团建系列一定要开坑啊，真的好久没看这么有趣的了[抓狂][抓狂][抓狂],3
把桥卖了,2
今天是我生日，你可以祝我生日快乐吗[害羞],2
[天官赐福·漫画纪念装扮_看书]你们四个又团建,2
已入股莫辜负！这期太可乐了哈哈哈哈哈哈哈[大笑]大半夜在寝室床上憋笑有多难[保卫萝卜_哭哭],2
再来一期！！,2
我的天太好看了好久没看到这么好看的了哈哈哈哈哈太喜欢了,2
这个真的超有趣 超好笑，剪辑也很棒，一点也不乱,2
开坑吧。。我哭了🥺,2
[脱单doge],2
现在流行晚上更新是吧[tv_doge][tv_doge][tv_doge],2
求求了，直播玩这个游戏吧！绝对效果炸裂！,2
催更！,2
几年过去了还是哥几个你们啊 可是我已经离开高中来边疆上大学啦,2
太有意思啦哈哈哈哈哈哈哈，还想看这个游戏的团建视频,2
开坑啊啊啊啊啊啊已经好久没这么喜欢一个实况了 真的有当初的味道了[大哭][大哭][大哭][大哭][大哭][大哭][大哭][大哭][大哭],2
适合小朋友看,2
果然，朋友才是游戏的最高配置[委屈],2
像我这种完全不了解这个游戏的人看的好乐！一下子就对这个游戏感兴趣了！,2
太好看了 我操,2
hello,2
我靠这个游戏联机真的爆有意思2333，期待下一期多往后探索探索,2
开坑！！这个游戏好适合你们！！,2
怎么办声音调大花少北声音吵，声音调小其他人声音太小[微笑][微笑][微笑],2
来了[星星眼][笑哭],2
只能说太了解对方了哈哈哈精准猜中飞船起飞哈哈哈,2
还有吗还有吗爱看！想看四个一起玩恐怖游戏测心率！！[打call][打call][打call][打call],2
能不能直播联机玩这个！！！,2
"《跟杜海皇说》
[tv_doge]",2
游戏名:  Lethal Company[脱单doge][脱单doge],2
好早！！！,2
看三遍了，好看，爱看，多更，快更！！！,2
不是脑叶公司玩不起，而是与朋友玩致命公司更有性价比,2
"某幻：“我们躲这里吓唬他们一下”
番茄：“好的”
（不到五秒）
某幻：“啊啊啊啊啊快快快快快怎么办怎么办怎么办怎么办怎么办啊啊啊啊啊”
番茄：“啊啊啊啊啊啊啊啊啊啊啊啊啊啊啊啊啊啊啊啊啊啊啊啊啊啊啊”",2
@杜海皇 海皇[doge],2
啊啊啊啊啊我服了这期boy好稳重好成熟好可靠谁懂啊我疯狂发疯,2
北子还没睡醒所以没有联合投稿是吧hhh,2
《温暖这个冬天》 谢谢哥几个 有被温暖到,2
我靠，久违的团建，北子哥的笑声好有穿透力和感染力啊哈哈哈哈哈哈哈哈哈哈哈哈哈哈哈哈哈哈哈，我跟着笑得直抽抽,2
呜呜呜呜呜呜爸爸妈妈哥哥姐姐呜呜呜这期真的有感觉呜呜呜呜特别特别好呜呜呜求你们了呜呜呜呜能不嫩开坑啊,2
啊啊啊啊啊这期真的很好看很好笑很欢乐，我要看下一集啊啊啊啊啊求大家点个三连吧！,2
这期真的好刺激搞笑[笑哭]请务必不顾数据得再来一期【UP_1577804_无敌】[大会员粉豆人_美琴投币][猫咪公寓_点赞],2
长长的视频，稳稳的安心[星光六角螈_给你点赞],2
这期真的太好笑了，谁懂啊，大半夜睡不着觉刷到这个视频，结果笑的更睡不着了哈哈哈哈哈哈哈哈哈哈哈哈哈哈哈,2
多发点哈哈哈哈哈哈好久没笑这么开心了你们在一起几个太有节目效果了,2
早,1
团建好好好,1
好早好早,1
救救我的女儿,1
（？,1
北汁你怎么没有联合投稿？[妙啊],1
懂了，北子哥被排挤了（bushi）,1
天呐今天过年了？？[热词系列_三连],1
唐,1
请持续更新啊啊啊啊啊！！！超喜欢看上班！！！,1
[热词系列_知识增加],1
花少北你人呢，北子哥——,1
番茄，你要好好照顾自己，记得按时喝酒，不舒服就多抽烟，每天好好熬夜，天冷了就多穿几件短袖。过马路的时候别忘了玩手机，记得多吃宵夜，不要经常吃早餐[脱单doge][脱单doge][脱单doge][脱单doge][给心心],1
[脱单doge],1
回忆效果-音效，闪白，噪点效果,0
万人桖书，开坑,0
